Name,Severity,Description,Family,URI,Attachments
Web Application Sitemap,info,"Publishes the sitemap of the web application as seen by the scan.

The list of all URLs that have been detected during the scan are available as an attachment. For each URL in the sitemap, the following information is provided:

- The first time the URL is detected - The logic used to detect the URL. This information may be found by: crawling rendering the page by a specific plugin - The parent URL requested to detect the URL - If the URL has been requested at least once, information about the response - Whether or not the URL has been queued for audit - If the URL has not been queued for audit, the reason why the URL does not need an audit - Whether or not the URL has been effectively audited - If the URL has not been effectively audited, the reason that the scanner was unable to audit the URL


Reasons for not adding a URL to the audit queue are as follows:

- not_in_domain: The domain of the URL does not match main target URL - scope_configuration: The URL does not match scope include list scan settings - directory_depth: The number of directories in the URL path exceeds the scan configuration setting - exclude_file_extension: The URL file extension matched one entry of the file extension blacklist setting - exclude_path_patterns: The URL matched one entry of the URL exclusion blacklist setting - redundant_path: The number of URLs to be audited with the same path and query string parameters has been reached - request_redirect_limit: The number of HTTP redirects allowed per scan configuration setting has been reached - queue_full: The number of URLs to audit has been reached


If a scan fails to audit a URL that has been queued for audit, reasons for the failure are as follows:

- timeout: The request timed out when trying to retrieve URL contents - filesize_exceeded: URL response exceeded file size limit defined in the scan configuration - scan_timelimit_reached: The URL couldn’t be audited before the scan time limit - user_abort: The user stopped the scan before the URL could be audited",General,https://<REACTED>-staging1-app.<REACTED>.com,https://cloud.tenable.com/was/v2/attachments/b10b5886-7d65-4696-bb68-846a3de49189
Interesting Response,info,"The scanner identified some responses with a status code other than the usual 200 (OK), 301 (Moved Permanently), 302 (Found) and 404 (Not Found) codes. These codes can provide useful insights into the behavior of the web application and identify any unexpected responses to be addressed.",Web Applications,https://<REACTED>-staging1-app.<REACTED>.com/.htaccess,"https://cloud.tenable.com/was/v2/attachments/79dc03ca-86b6-485e-8aec-f0369edfcf65, https://cloud.tenable.com/was/v2/attachments/5548019a-7918-49e7-865a-5aff5fb8c640"
Missing 'X-XSS-Protection' Header (deprecated),info,"The HTTP 'X-XSS-Protection' response header is a feature of old browsers that allows websites to control their XSS auditors.\n\nThe server is not configured to return a 'X-XSS-Protection' header which means that any pages on this website could be at risk of a Cross-Site Scripting (XSS) attack. This URL is flagged as a specific example.\n\nHowever, this header is deprecated by modern browsers, if legacy browsers support is not needed, it is recommended to use Content-Security-Policy without allowing unsafe-inline scripts instead.",HTTP Security Header,https://<REACTED>-staging1-app.<REACTED>.com/,"https://cloud.tenable.com/was/v2/attachments/4e0402c9-60e4-46b6-959b-eb964dfa0913, https://cloud.tenable.com/was/v2/attachments/e6cf49d3-2c1e-475f-8a17-6dac6455860e"
Permissive Content Security Policy Detected,low,"Content Security Policy (CSP) is a web security standard that helps to mitigate attacks like cross-site scripting (XSS), clickjacking or mixed content issues. CSP provides mechanisms to websites to restrict content that browsers will be allowed to load.

One or several permissive directives have been detected. See output for more details.",HTTP Security Header,https://<REACTED>-staging1-app.<REACTED>.com/,"https://cloud.tenable.com/was/v2/attachments/80615c52-2938-4855-8b1d-b8ca082796c7, https://cloud.tenable.com/was/v2/attachments/eda8415a-2744-4535-8068-decb292191ed"
Security.txt File Not Detected,info,"A Security.txt file has not been detected on the target.

When security risks in web services are discovered by independent security researchers, this file defines the channels to disclose them properly & enables 3rd party researchers to disclose issues securely in a manner defined by the organization.

Organizations should consider creating a security.txt file containing contact and other information in the defined format and place it under the .well-known directory of the server.",Web Servers,https://<REACTED>-staging1-app.<REACTED>.com/,"https://cloud.tenable.com/was/v2/attachments/11194082-9978-497d-b4c6-b4173f6c6ed4, https://cloud.tenable.com/was/v2/attachments/a51019bf-b476-462c-a738-a8838eb11a36"
Interesting Response,info,"The scanner identified some responses with a status code other than the usual 200 (OK), 301 (Moved Permanently), 302 (Found) and 404 (Not Found) codes. These codes can provide useful insights into the behavior of the web application and identify any unexpected responses to be addressed.",Web Applications,https://<REACTED>-staging1-app.<REACTED>.com/jspwebshell12.jsp,"https://cloud.tenable.com/was/v2/attachments/b474dbfe-2bfb-4aa5-b46e-eac44df6f432, https://cloud.tenable.com/was/v2/attachments/f87f0ff6-d6ac-4855-a524-bbb1d37fe1b2"
E-mail Address Disclosure,info,"Email addresses are typically found on ""Contact us"" pages, however, they can also be found within scripts or code comments of the application. They are used to provide a legitimate means of contacting an organisation.

As one of the initial steps in information gathering, cyber-criminals will spider a website and using automated methods collect as many email addresses as possible, that they may then use in a social engineering attack.

Using the same automated methods, scanner was able to detect one or more email addresses that were stored within the affected page.",Data Exposure,https://<REACTED>-staging1-app.<REACTED>.com,https://cloud.tenable.com/was/v2/attachments/160e42ea-9d4d-4df0-962b-dc0938d7e210
SSL/TLS Weak Cipher Suites Supported,low,The remote host supports the use of SSL/TLS ciphers that offer weak encryption (including RC4 and 3DES encryption).,SSL/TLS,https://<REACTED>-staging1-app.<REACTED>.com/,https://cloud.tenable.com/was/v2/attachments/7842b673-f0ff-48a5-a544-a9c757261bf3
Interesting Response,info,"The scanner identified some responses with a status code other than the usual 200 (OK), 301 (Moved Permanently), 302 (Found) and 404 (Not Found) codes. These codes can provide useful insights into the behavior of the web application and identify any unexpected responses to be addressed.",Web Applications,https://<REACTED>-staging1-app.<REACTED>.com/.htpasswd,"https://cloud.tenable.com/was/v2/attachments/c85336a9-6763-4f6f-9960-2cab2d3bfa75, https://cloud.tenable.com/was/v2/attachments/cdbbe223-8142-4e15-a2e9-98874254e53d"
Allowed HTTP Versions,info,"The Hypertext Transfer Protocol (HTTP) is the underlying protocol of the World Wide Web. Since its first release, HTTP has evolved to support modern web usages and currently exists in three versions:
 - HTTP/1.0
 - HTTP/1.1
 - HTTP/2

The scanner identified the supported versions of the HTTP protocol on the target web application.",Web Applications,https://<REACTED>-staging1-app.<REACTED>.com,"https://cloud.tenable.com/was/v2/attachments/8abcc2f0-7b0e-4547-889c-6d710ac4ce6e, https://cloud.tenable.com/was/v2/attachments/1c6903ae-72d3-4984-a47e-41a5a69a6313, https://cloud.tenable.com/was/v2/attachments/274f107e-7bdd-4379-a6c5-e44c7aad5938, https://cloud.tenable.com/was/v2/attachments/8a76ffd7-6046-4141-8a45-b9d9f8c70b51"
HTTP Strict Transport Security Policy Detected,info,"HTTP Strict Transport Security (HSTS) is an optional response header that can be configured on the server to instruct the browser to only communicate via HTTPS.

The HSTS policy can be defined with the following settings :

 - max-age: the time, in seconds, that the browser should remember that a site is only to be accessed in HTTPS.

 - includeSubDomains (optional) : if this attribute is specified, the policy applies to all current site subdomains.

 - preload (optional) : Google maintains a compiled list of domains which is directly distributed in some browsers to enforce HTTPS without checking for the HSTS HTTP header. As the domain submission process is public, the preload attribute is used as a validation when a domain is submitted for preloading.

The scanner detected a HSTS policy on the target application.",HTTP Security Header,https://<REACTED>-staging1-app.<REACTED>.com/,"https://cloud.tenable.com/was/v2/attachments/fbfd891a-020b-4a00-833d-1227a392bc17, https://cloud.tenable.com/was/v2/attachments/fdd823ae-de42-46e9-8609-5eee25ffa364"
Interesting Response,info,"The scanner identified some responses with a status code other than the usual 200 (OK), 301 (Moved Permanently), 302 (Found) and 404 (Not Found) codes. These codes can provide useful insights into the behavior of the web application and identify any unexpected responses to be addressed.",Web Applications,https://<REACTED>-staging1-app.<REACTED>.com/siteminderagent/forms/smpwservices.fcc?USERNAME=%5Cu003cimg%5Cu0020src%5Cu003dx%5Cu0020onerror%5Cu003dconsole.log%281%29%5Cu003e&SMAUTHREASON=7,"https://cloud.tenable.com/was/v2/attachments/4acb29b0-a4ed-40d1-a112-c2cf9798bdbc, https://cloud.tenable.com/was/v2/attachments/d17153f4-4aa4-46d1-8a1e-575d4560a29a"
Cookie Without Secure Flag Detected,low,"When the `secure` flag is set on a cookie, the browser will prevent it from being sent over a clear text channel (HTTP) and only allow it to be sent when an encrypted channel is used (HTTPS).

The scanner discovered that a cookie was set by the server without the secure flag being set. Although the initial setting of this cookie was via an HTTPS connection, any HTTP link to the same server will result in the cookie being sent in clear text.

Note that if the cookie does not contain sensitive information, the risk of this vulnerability is mitigated.",HTTP Security Header,https://<REACTED>-staging1-app.<REACTED>.com/,"https://cloud.tenable.com/was/v2/attachments/6c1ecc35-cd14-4cb3-af98-d027245941e1, https://cloud.tenable.com/was/v2/attachments/29c0287a-4da5-4881-8a5b-e102d6667ab3"
Selenium Authentication Succeeded,info,This is an informational notice that the scanner was able to successfully authenticate against the web application using the Selenium script provided in the scan policy.,Authentication & Session,https://<REACTED>-staging1-app.<REACTED>.com,"https://cloud.tenable.com/was/v2/attachments/96156f58-d5a2-4402-bf72-185e32ed4860, https://cloud.tenable.com/was/v2/attachments/dc345571-fda0-49f5-8970-516afeb494d7, https://cloud.tenable.com/was/v2/attachments/56081e90-3d7d-463e-ad3b-6177aff1f559, https://cloud.tenable.com/was/v2/attachments/a50b633d-623d-4d80-8043-0a960515d54a, https://cloud.tenable.com/was/v2/attachments/d3b69f1f-0f09-456c-a14b-72595c8132c4, https://cloud.tenable.com/was/v2/attachments/6362b711-a84d-46ef-a2d4-b7e37f6c91f4, https://cloud.tenable.com/was/v2/attachments/37ea48f4-493d-4565-a063-55bfa23d3b86, https://cloud.tenable.com/was/v2/attachments/20ef63f4-0e29-4647-b3f8-a941e7e969b5, https://cloud.tenable.com/was/v2/attachments/535e1828-8ac0-4314-9633-6f1e35301ca2, https://cloud.tenable.com/was/v2/attachments/7e21bc97-d21a-4ad0-acae-d31d0f60ad97, https://cloud.tenable.com/was/v2/attachments/cb0208af-5422-4aa9-9a1d-546199126923, https://cloud.tenable.com/was/v2/attachments/39dc694c-cc21-4c1d-a6cf-514448e1b067, https://cloud.tenable.com/was/v2/attachments/5c733ddd-c7d1-4f9f-a3be-fca880100551"
SSL/TLS Versions Supported,info,This plugin displays information about the SSL/TLS versions supported by remote server for HTTPS connection.,SSL/TLS,https://<REACTED>-staging1-app.<REACTED>.com/,
Interesting Response,info,"The scanner identified some responses with a status code other than the usual 200 (OK), 301 (Moved Permanently), 302 (Found) and 404 (Not Found) codes. These codes can provide useful insights into the behavior of the web application and identify any unexpected responses to be addressed.",Web Applications,https://<REACTED>-staging1-app.<REACTED>.com/jspwebshell.jsp,"https://cloud.tenable.com/was/v2/attachments/6009605e-5a58-40b1-9e01-7939f220e866, https://cloud.tenable.com/was/v2/attachments/6a677724-c794-4c69-b15c-aa75e7d68035"
Interesting Response,info,"The scanner identified some responses with a status code other than the usual 200 (OK), 301 (Moved Permanently), 302 (Found) and 404 (Not Found) codes. These codes can provide useful insights into the behavior of the web application and identify any unexpected responses to be addressed.",Web Applications,https://<REACTED>-staging1-app.<REACTED>.com/cpanelwebcall/%3Cimg%20src=x%20onerror=%22console.log(1)%22%3E,"https://cloud.tenable.com/was/v2/attachments/bd03d90e-d784-4169-a920-75a068407360, https://cloud.tenable.com/was/v2/attachments/b72b4961-7bfe-44c9-868f-9a060b6bf730"
Allowed HTTP Methods,info,"There are a number of HTTP methods that can be used on a webserver (`OPTIONS`, `HEAD`, `GET`, `POST`, `PUT`, `DELETE` etc.). Each of these methods perform a different function and each have an associated level of risk when their use is permitted on the webserver.

By sending an HTTP OPTIONS request and a direct HTTP request for each method, the scanner discovered the methods that are allowed by the server.",Web Applications,https://<REACTED>-staging1-app.<REACTED>.com,https://cloud.tenable.com/was/v2/attachments/fbca303e-aed7-495f-a09d-20f0fe6d84c5
Interesting Response,info,"The scanner identified some responses with a status code other than the usual 200 (OK), 301 (Moved Permanently), 302 (Found) and 404 (Not Found) codes. These codes can provide useful insights into the behavior of the web application and identify any unexpected responses to be addressed.",Web Applications,https://<REACTED>-staging1-app.<REACTED>.com/index.php?s=index/think%5CError/appError&errno=1&errstr=%3C&errline=1&errfile=../../../../../etc/passwd,"https://cloud.tenable.com/was/v2/attachments/711bd538-1fee-44a3-8bd3-9d20e60b1aef, https://cloud.tenable.com/was/v2/attachments/c11cf42e-3050-4150-84ff-56871b199432"
Interesting Response,info,"The scanner identified some responses with a status code other than the usual 200 (OK), 301 (Moved Permanently), 302 (Found) and 404 (Not Found) codes. These codes can provide useful insights into the behavior of the web application and identify any unexpected responses to be addressed.",Web Applications,https://<REACTED>-staging1-app.<REACTED>.com/jsp-reverse.jsp,"https://cloud.tenable.com/was/v2/attachments/f21fdb2f-f9c2-447c-8e13-7c9feb769776, https://cloud.tenable.com/was/v2/attachments/9d52074d-294f-4af3-a827-b80075a6c7b8"
API Detected,info,The scan detected that some XHR requests seem to call an API. The scanner generated an OpenAPI file based on the observed requests and attached it to the plugin output. This OpenAPI file can then be used to run a scan against the API with WAS API Scanning.,General,https://<REACTED>-staging1-app.<REACTED>.com,"https://cloud.tenable.com/was/v2/attachments/491d1947-04da-4e05-ae52-27c0206694fd, https://cloud.tenable.com/was/v2/attachments/097c6d0d-1549-4a60-b951-090b4971aaee, https://cloud.tenable.com/was/v2/attachments/36933082-e477-421d-9211-5d71ca2d1ded, https://cloud.tenable.com/was/v2/attachments/17705cd1-3178-4831-bccd-5aa3ef8fe1dc, https://cloud.tenable.com/was/v2/attachments/f426e21f-dd75-475c-a586-74646bfc3cb7, https://cloud.tenable.com/was/v2/attachments/4a2df9d3-69e3-4b22-909d-e12f28106a7f, https://cloud.tenable.com/was/v2/attachments/cdb4198c-206e-441c-b16c-c47cc019c015"
Cookie Without HttpOnly Flag Detected,low,"The HttpOnly flag assists in the prevention of client side-scripts (such as JavaScript) from accessing and using the cookie.

This can help prevent XSS attacks from targeting the cookies holding the client's session token (setting the HttpOnly flag does not prevent, nor safeguard against XSS vulnerabilities themselves).",HTTP Security Header,https://<REACTED>-staging1-app.<REACTED>.com/,"https://cloud.tenable.com/was/v2/attachments/85142904-e3e5-48ee-a60d-99237a5bd941, https://cloud.tenable.com/was/v2/attachments/da0bdb0a-9c53-4afc-9225-fab0c529b915"
Web Application Firewall Detected,info,"A Web Application Firewall (WAF) has been detected during the scan. A WAF is designed to help protecting web applications by monitoring and filtering HTTP(S) traffic through a set of rules in order to prevent the most common attacks.

. The identified WAF may have blocked several requests during the vulnerability assessment or have declined access to some resources of the web application during the scan (blocked URLs have been provided in the plugin attachments).

It is recommended to scan the web application by ensuring that the traffic coming from the scanner is allowed by the WAF in order to get the most accurate coverage of the target application vulnerabilities. If needed, the Tenable WAS documentation defines the scanners IP ranges to be allowed in the WAF configuration.",General,https://<REACTED>-staging1-app.<REACTED>.com,https://cloud.tenable.com/was/v2/attachments/5cd47d6b-6ab9-4703-ba54-13009fd63e53
SSL/TLS Certificate Information,info,This plugin displays information about the X.509 certificate extracted from the HTTPS connection.,SSL/TLS,https://<REACTED>-staging1-app.<REACTED>.com/,https://cloud.tenable.com/was/v2/attachments/c1650ba8-4235-4bab-bd83-1943ad41208d
SSL/TLS Cipher Suites Supported,info,This plugin displays supported SSL/TLS cipher suites.,SSL/TLS,https://<REACTED>-staging1-app.<REACTED>.com/,https://cloud.tenable.com/was/v2/attachments/26e20631-3ba7-4eb6-8551-917f29de1304
Disabled 'X-XSS-Protection' Header (deprecated),info,"The HTTP 'X-XSS-Protection' response header is a feature of modern browsers that allows websites to control their XSS auditors.

The server did not return a correct 'X-XSS-Protection' header, which means that this website could be at risk of a Cross-Site Scripting (XSS) attack.

If legacy browsers support is not needed, it is recommended to use Content-Security-Policy without allowing unsafe-inline scripts instead.",HTTP Security Header,https://<REACTED>-staging1-app.<REACTED>.com/,"https://cloud.tenable.com/was/v2/attachments/d0fc8568-d005-4fc5-8d71-14f5e9e8cfd6, https://cloud.tenable.com/was/v2/attachments/cf586ccf-2904-45b5-ad82-c8ecd8564f07"
SSL/TLS Forward Secrecy Cipher Suites Not Supported,medium,The remote host use at least one SSL/TLS ciphers that does not offer forward secrecy (FS) also known as perfect forward secrecy (PFS). It's a feature that provides assurances the session keys will not be compromised even if the server’s private key is compromised.,SSL/TLS,https://<REACTED>-staging1-app.<REACTED>.com/,https://cloud.tenable.com/was/v2/attachments/9423df34-13c8-409c-befe-c2c4f9e50fd9
Interesting Response,info,"The scanner identified some responses with a status code other than the usual 200 (OK), 301 (Moved Permanently), 302 (Found) and 404 (Not Found) codes. These codes can provide useful insights into the behavior of the web application and identify any unexpected responses to be addressed.",Web Applications,https://<REACTED>-staging1-app.<REACTED>.com/<REACTED>asp.aspx,"https://cloud.tenable.com/was/v2/attachments/6d570050-035d-475f-b85d-7e3fc21de347, https://cloud.tenable.com/was/v2/attachments/4984425a-e6eb-44ee-8a83-a9815edadca0"
Interesting Response,info,"The scanner identified some responses with a status code other than the usual 200 (OK), 301 (Moved Permanently), 302 (Found) and 404 (Not Found) codes. These codes can provide useful insights into the behavior of the web application and identify any unexpected responses to be addressed.",Web Applications,https://<REACTED>-staging1-app.<REACTED>.com/plugins/servlet/oauth/users/icon-uri?consumerUri=,"https://cloud.tenable.com/was/v2/attachments/f8f955d3-b052-4fbb-94bd-ac95ee3b9b08, https://cloud.tenable.com/was/v2/attachments/dc9ce77c-0db7-44ac-93f2-6e440f0ac79f"
Interesting Response,info,"The scanner identified some responses with a status code other than the usual 200 (OK), 301 (Moved Permanently), 302 (Found) and 404 (Not Found) codes. These codes can provide useful insights into the behavior of the web application and identify any unexpected responses to be addressed.",Web Applications,https://<REACTED>-staging1-app.<REACTED>.com/owa/auth/login.aspx,"https://cloud.tenable.com/was/v2/attachments/1fedbb5a-96ba-4ab6-8c1e-7a8ab282c72f, https://cloud.tenable.com/was/v2/attachments/af1612c6-8fea-4fb7-9c60-0cb6ab4a7b7b"
Interesting Response,info,"The scanner identified some responses with a status code other than the usual 200 (OK), 301 (Moved Permanently), 302 (Found) and 404 (Not Found) codes. These codes can provide useful insights into the behavior of the web application and identify any unexpected responses to be addressed.",Web Applications,https://<REACTED>-staging1-app.<REACTED>.com/go/add-on/business-continuity/api/plugin?folderName=&pluginName=../../../etc/passwd,"https://cloud.tenable.com/was/v2/attachments/9a9847ef-e315-49e0-9793-0e8432dae06e, https://cloud.tenable.com/was/v2/attachments/458d6412-1e08-4b25-bb43-e138fad4c2a4"
Missing Referrer Policy,info,"Referrer Policy provides mechanisms to websites to restrict referrer information (sent in the referer header) that browsers will be allowed to add.

No Referrer Policy header or metatag configuration has been detected.",HTTP Security Header,https://<REACTED>-staging1-app.<REACTED>.com/,"https://cloud.tenable.com/was/v2/attachments/ecb894e3-8ee8-4698-a06a-7f96e065c205, https://cloud.tenable.com/was/v2/attachments/d25135ef-26ce-4684-ae68-2fb414353bda"
SSL/TLS Server Cipher Suite Preference Not Detected,info,"The remote server is not configured with a SSL/TLS cipher suite preference list, making the cipher suite selection during the negotiation use the ordered list from the client.",SSL/TLS,https://<REACTED>-staging1-app.<REACTED>.com/,
SSL/TLS Certificate Contains Wildcard Entries,info,The remote server presents an SSL/TLS certificate with wildcard entries. The use of a wildcard character in a entry permits a certificate to cover a number of subdomains of a domain.,SSL/TLS,https://<REACTED>-staging1-app.<REACTED>.com/,https://cloud.tenable.com/was/v2/attachments/94292c76-936d-4822-a24c-e003c04797be
Interesting Response,info,"The scanner identified some responses with a status code other than the usual 200 (OK), 301 (Moved Permanently), 302 (Found) and 404 (Not Found) codes. These codes can provide useful insights into the behavior of the web application and identify any unexpected responses to be addressed.",Web Applications,https://<REACTED>-staging1-app.<REACTED>.com/vendor/htmlawed/htmlawed/htmLawedTest.php,"https://cloud.tenable.com/was/v2/attachments/8b07428b-ded8-491b-9f4c-ad63edfad518, https://cloud.tenable.com/was/v2/attachments/1be2f985-aac3-41ec-b2ad-f8f4bab30207"
Interesting Response,info,"The scanner identified some responses with a status code other than the usual 200 (OK), 301 (Moved Permanently), 302 (Found) and 404 (Not Found) codes. These codes can provide useful insights into the behavior of the web application and identify any unexpected responses to be addressed.",Web Applications,https://<REACTED>-staging1-app.<REACTED>.com/<REACTED>jsp.jsp,"https://cloud.tenable.com/was/v2/attachments/92a64254-0c9a-4a26-86cf-256629259cf9, https://cloud.tenable.com/was/v2/attachments/7bf4d30a-4a36-4ed3-bd0f-4ecacbfc6887"
Interesting Response,info,"The scanner identified some responses with a status code other than the usual 200 (OK), 301 (Moved Permanently), 302 (Found) and 404 (Not Found) codes. These codes can provide useful insights into the behavior of the web application and identify any unexpected responses to be addressed.",Web Applications,https://<REACTED>-staging1-app.<REACTED>.com/assets/file:%2f%2f/etc/passwd,"https://cloud.tenable.com/was/v2/attachments/2048e14d-fb04-4c35-9240-e5cdd3b9ff2f, https://cloud.tenable.com/was/v2/attachments/87075d98-1740-4b46-90d3-ea1e68f911eb"
Performance Telemetry,info,This finding provides information to assist in scan performance tuning.,General,https://<REACTED>-staging1-app.<REACTED>.com,"https://cloud.tenable.com/was/v2/attachments/81cf1fe1-c8e5-4fa9-a44a-607ab3e1de20, https://cloud.tenable.com/was/v2/attachments/28a04cc0-59fd-475d-8fca-50ddef6d29c0, https://cloud.tenable.com/was/v2/attachments/73d1fc78-822c-4cb4-bbeb-3cfb3ab94d3a"
Interesting Response,info,"The scanner identified some responses with a status code other than the usual 200 (OK), 301 (Moved Permanently), 302 (Found) and 404 (Not Found) codes. These codes can provide useful insights into the behavior of the web application and identify any unexpected responses to be addressed.",Web Applications,https://<REACTED>-staging1-app.<REACTED>.com/console/login/LoginForm.jsp,"https://cloud.tenable.com/was/v2/attachments/ae1248a0-b921-44cf-87d0-47194e997520, https://cloud.tenable.com/was/v2/attachments/de804226-1f08-438f-bd27-69bbc3a6aae6"
Interesting Response,info,"The scanner identified some responses with a status code other than the usual 200 (OK), 301 (Moved Permanently), 302 (Found) and 404 (Not Found) codes. These codes can provide useful insights into the behavior of the web application and identify any unexpected responses to be addressed.",Web Applications,https://<REACTED>-staging1-app.<REACTED>.com/php_error_log,"https://cloud.tenable.com/was/v2/attachments/e0fe1f9a-e8c0-4485-bdcf-ec0984150368, https://cloud.tenable.com/was/v2/attachments/1ce76b2d-5019-4fdf-bc89-20df5b2dfaa6"
